{
  "schemaVersion": 2,
  "auditId": "version-readiness-audit-v2.4.0-2026-07-30",
  "auditedVersion": "v2.4.0",
  "auditedAt": "2026-07-30",
  "verdict": "hold",
  "overallScore": 43,
  "implementationReadiness": "Not implementation-ready. Publisher Platform and Ecosystem SDK defines governed intent but lacks decision-complete runtime, contract, assurance, verification, migration, and operating specifications.",
  "executiveVerdict": "A new engineering team or AI coding agent cannot implement v2.4.0 without inventing material behavior. Its explicit open questions, normative contracts, threat boundaries, executable test matrix, migration and rollback state, and service objectives require approval before implementation.",
  "dependencyStatus": "v2.3.0 remains HOLD; this version inherits that release blocker without duplicating its owned findings.",
  "inheritedDependencyBlockers": [
    {
      "version": "v2.3.0",
      "auditId": "version-readiness-audit-v2.3.0-2026-07-30",
      "summary": "v2.3.0 remains HOLD and must be independently approved before this version can advance."
    }
  ],
  "scores": {
    "product": 51,
    "architecture": 43,
    "engineering": 35,
    "documentation": 47,
    "security": 39,
    "testing": 37,
    "release": 43,
    "enterpriseReadiness": 38,
    "openSourceReadiness": 49,
    "aiAgentReadiness": 33,
    "maintainability": 41,
    "extensibility": 43
  },
  "blockers": [
    {
      "id": "V240-B01",
      "summary": "Implementation decision remains unresolved: Which identity proof is required for official publishers?",
      "sourceReference": "docs/versions/v2.4.0/decisions/index.md"
    },
    {
      "id": "V240-B02",
      "summary": "Implementation decision remains unresolved: How are abandoned critical packages escrowed or transferred?",
      "sourceReference": "docs/versions/v2.4.0/decisions/index.md"
    },
    {
      "id": "V240-B03",
      "summary": "Architecture delta lacks executable component and state contracts",
      "sourceReference": "docs/versions/v2.4.0/architecture/delta.md"
    },
    {
      "id": "V240-B04",
      "summary": "Threat boundaries, permissions, and data flow are not decision-complete",
      "sourceReference": "docs/versions/v2.4.0/assurance/assurance-plan.md"
    }
  ],
  "findings": [
    {
      "id": "V240-F01",
      "severity": "critical",
      "category": "product-and-architecture-decision",
      "summary": "Implementation decision remains unresolved: Which identity proof is required for official publishers?",
      "affectedFeatures": [
        "capability-studio-sdk",
        "governed-publisher-lifecycle"
      ],
      "sourceReference": "docs/versions/v2.4.0/decisions/index.md",
      "question": "Which identity proof is required for official publishers?",
      "impact": "The version package explicitly identifies this as unresolved, so implementers would have to choose behavior without approved authority.",
      "owner": "Publisher Platform Maintainers",
      "targetDocument": "docs/versions/v2.4.0/decisions/open-question-1.md",
      "requiredArtifact": "Approved RFC and ADR with rejected alternatives",
      "dependency": "v2.3.0",
      "remediation": "Resolve the decision with normative behavior, alternatives, ownership, compatibility, security, migration, rollback, operational, and support consequences.",
      "acceptanceEvidence": "Approved decision record, linked contract updates, objective conformance examples, and independent re-audit.",
      "blocking": true
    },
    {
      "id": "V240-F02",
      "severity": "critical",
      "category": "product-and-architecture-decision",
      "summary": "Implementation decision remains unresolved: How are abandoned critical packages escrowed or transferred?",
      "affectedFeatures": [
        "capability-studio-sdk",
        "governed-publisher-lifecycle"
      ],
      "sourceReference": "docs/versions/v2.4.0/decisions/index.md",
      "question": "How are abandoned critical packages escrowed or transferred?",
      "impact": "The version package explicitly identifies this as unresolved, so implementers would have to choose behavior without approved authority.",
      "owner": "Publisher Platform Maintainers",
      "targetDocument": "docs/versions/v2.4.0/decisions/open-question-2.md",
      "requiredArtifact": "Approved RFC and ADR with rejected alternatives",
      "dependency": "v2.3.0",
      "remediation": "Resolve the decision with normative behavior, alternatives, ownership, compatibility, security, migration, rollback, operational, and support consequences.",
      "acceptanceEvidence": "Approved decision record, linked contract updates, objective conformance examples, and independent re-audit.",
      "blocking": true
    },
    {
      "id": "V240-F03",
      "severity": "critical",
      "category": "architecture-and-state",
      "summary": "Architecture delta lacks executable component and state contracts",
      "affectedFeatures": [
        "capability-studio-sdk",
        "governed-publisher-lifecycle"
      ],
      "sourceReference": "docs/versions/v2.4.0/architecture/delta.md",
      "question": "What exact components, state machines, ownership boundaries, invariants, and failure transitions implement Publisher Platform and Ecosystem SDK?",
      "impact": "The current architecture describes intent but cannot drive deterministic decomposition, concurrency behavior, crash recovery, or implementation ownership.",
      "owner": "Publisher Platform Maintainers",
      "targetDocument": "docs/versions/v2.4.0/architecture/executable-design.md",
      "requiredArtifact": "Approved architecture design and state-transition contract",
      "dependency": "Add schema-driven Capability Studio profiles, publisher APIs, adapter/converter SDKs, staged publication, identity, ownership, recovery, and moderation workflows.",
      "remediation": "Specify components, responsibilities, persisted state, control and data flows, concurrency, idempotency, failure states, recovery, extension points, and prohibited coupling.",
      "acceptanceEvidence": "Approved diagrams, state tables, invariants, failure scenarios, and architecture conformance checks.",
      "blocking": true
    },
    {
      "id": "V240-F04",
      "severity": "critical",
      "category": "security-trust-and-data-flow",
      "summary": "Threat boundaries, permissions, and data flow are not decision-complete",
      "affectedFeatures": [
        "capability-studio-sdk",
        "governed-publisher-lifecycle"
      ],
      "sourceReference": "docs/versions/v2.4.0/assurance/assurance-plan.md",
      "question": "Which identities, permissions, data classes, trust roots, external effects, retention rules, and human approvals apply to each operation?",
      "impact": "Security, privacy, consent, and human-authority controls cannot be implemented or tested without explicit trust and data-flow contracts.",
      "owner": "Publisher Platform Maintainers; Security Maintainers",
      "targetDocument": "docs/versions/v2.4.0/assurance/threat-model-and-data-flow.md",
      "requiredArtifact": "Threat model, privacy review, permission matrix, and abuse-case analysis",
      "dependency": "Platform Constitution, policy, vault, consent, audit, and rollback authorities",
      "remediation": "Document assets, actors, trust boundaries, threats, permission propagation, data classification, retention, deletion, residency, redaction, consent, emergency controls, and residual risks.",
      "acceptanceEvidence": "Approved threat model with negative, adversarial, bypass, redaction, revocation, and recovery tests.",
      "blocking": true
    },
    {
      "id": "V240-F05",
      "severity": "high",
      "category": "public-contracts",
      "summary": "CLI, API, SDK, schema, and compatibility contracts remain descriptive",
      "affectedFeatures": [
        "capability-studio-sdk",
        "governed-publisher-lifecycle"
      ],
      "sourceReference": "docs/versions/v2.4.0/interfaces/contracts.md",
      "question": "What are the exact commands, request and response schemas, stable errors, version negotiation, lifecycle states, compatibility rules, and deprecation behavior?",
      "impact": "Independent implementations would expose incompatible public behavior and could bypass shared domain controls.",
      "owner": "Publisher Platform Maintainers",
      "targetDocument": "docs/versions/v2.4.0/interfaces/normative-contracts.md",
      "requiredArtifact": "Versioned schemas, interface definitions, examples, and contract fixtures",
      "dependency": "Version publisher, SDK, validation, signing, promotion, deprecation, withdrawal, ownership transfer, dispute, and recovery contracts.; Add publish validate, sign, test, preview, submit, deprecate, withdraw, and builder profile commands.",
      "remediation": "Define syntax, types, validation, envelopes, errors, pagination or streaming, cancellation, accessibility, policy and consent boundaries, compatibility, deprecation, and conformance fixtures.",
      "acceptanceEvidence": "Schema-valid golden examples and cross-surface contract tests for positive and negative paths.",
      "blocking": true
    },
    {
      "id": "V240-F06",
      "severity": "high",
      "category": "testing-and-evaluation",
      "summary": "Evidence requirements do not define an executable verification matrix",
      "affectedFeatures": [
        "capability-studio-sdk",
        "governed-publisher-lifecycle"
      ],
      "sourceReference": "docs/versions/v2.4.0/evidence/evidence-requirements.json",
      "question": "Which fixtures, environments, fault models, security cases, performance thresholds, compatibility matrices, and pass criteria certify each committed feature?",
      "impact": "Teams cannot determine completion, reproduce claims, or distinguish required evidence from future aspirational results.",